{
  "contract_version": "line-stability-report/1.0",
  "report_id": "LSR-1791605497-vc2b3v",
  "generated_at": "2026-10-10T04:11:37Z",
  "status": "ok",
  "line": {
    "line_id": "LSR-DEMO-1",
    "product": null
  },
  "period": {
    "start": "2026-10-07 08:00:00",
    "end": "2026-10-10 07:55:00",
    "requested": {
      "start": null,
      "end": null
    }
  },
  "data": {
    "path": "D:\\codes\\industrial-deep-diagnostic\\data\\lsr_demo\\line_demo.csv",
    "sha256": "sha256:51e144266bf49fef8f646fb160ba5c99b2ae0acbacb8e1d7ed5d29d09bf6a6ea",
    "time_col": "t",
    "group_col": null,
    "group_used": null,
    "parameter_cols": [
      "reactor_temp",
      "feed_rate",
      "cooling_flow",
      "yield_pct"
    ],
    "inspection_cols": [
      "yield_pct"
    ],
    "ignored_cols": [],
    "n_rows_raw": 864,
    "n_rows_used": 864,
    "time_span_seconds": 258900.0,
    "sampling_interval_median_seconds": 300.0,
    "missing_rate": 0.0,
    "coverage_ratio": 1.0
  },
  "parameters": [
    {
      "name": "reactor_temp",
      "role": "parameter",
      "n": 864,
      "mu": 79.99832,
      "median": 80.004007,
      "sigma": 0.356217,
      "sigma_within_mr": 0.336836,
      "cv": 0.00445,
      "min": 78.962415,
      "max": 81.889538,
      "spec": {
        "lsl": null,
        "usl": null,
        "target": null
      },
      "capability": {
        "cp": null,
        "cpk": null,
        "pp": null,
        "ppk": null
      },
      "nelson": {
        "R1": {
          "n_violations": 7,
          "indices": [
            139,
            248,
            412,
            504,
            700,
            701,
            846
          ]
        },
        "R2": {
          "n_violations": 3,
          "indices": [
            51,
            242,
            243
          ]
        },
        "R3": {
          "n_violations": 3,
          "indices": [
            65,
            139,
            558
          ]
        },
        "R5": {
          "n_violations": 5,
          "indices": [
            138,
            410,
            411,
            452,
            700
          ]
        },
        "R6": {
          "n_violations": 3,
          "indices": [
            94,
            242,
            769
          ]
        }
      },
      "n_violation_points": 21,
      "drift": {
        "slope_per_second": 0.002649,
        "per_day_relative": 2.860982,
        "mk_p": 0.848738,
        "significant": false
      },
      "baseline_ref": null,
      "score": 98,
      "score_breakdown": {
        "base": 100,
        "nelson_penalty": -2,
        "cv_penalty": 0,
        "capability_penalty": 0,
        "drift_penalty": 0,
        "baseline_penalty": 0,
        "total": 98
      }
    },
    {
      "name": "feed_rate",
      "role": "parameter",
      "n": 864,
      "mu": 104.758005,
      "median": 104.574952,
      "sigma": 0.781356,
      "sigma_within_mr": 0.181867,
      "cv": 0.007454,
      "min": 103.343286,
      "max": 106.63013,
      "spec": {
        "lsl": null,
        "usl": null,
        "target": null
      },
      "capability": {
        "cp": null,
        "cpk": null,
        "pp": null,
        "ppk": null
      },
      "nelson": {
        "R1": {
          "n_violations": 489,
          "indices": [
            0,
            2,
            3,
            4,
            5,
            7,
            9,
            10,
            11,
            12,
            13,
            14,
            15,
            18,
            19,
            20,
            23,
            24,
            25,
            26,
            27,
            28,
            29,
            30,
            32,
            33,
            35,
            37,
            38,
            40,
            42,
            43,
            44,
            45,
            46,
            49,
            55,
            56,
            57,
            58,
            59,
            60,
            62,
            64,
            65,
            66,
            72,
            73,
            81,
            83,
            85,
            86,
            89,
            90,
            92,
            94,
            97,
            98,
            99,
            100,
            101,
            102,
            103,
            105,
            106,
            107,
            110,
            111,
            113,
            114,
            117,
            122,
            124,
            125,
            130,
            133,
            134,
            136,
            137,
            138,
            140,
            143,
            146,
            148,
            149,
            150,
            151,
            152,
            153,
            154,
            160,
            161,
            162,
            163,
            164,
            168,
            170,
            171,
            173,
            176,
            179,
            180,
            181,
            182,
            184,
            186,
            187,
            188,
            190,
            192,
            194,
            196,
            198,
            200,
            201,
            202,
            205,
            206,
            207,
            208,
            209,
            210,
            214,
            217,
            219,
            220,
            221,
            222,
            223,
            225,
            226,
            227,
            230,
            240,
            242,
            243,
            247,
            248,
            249,
            250,
            251,
            253,
            255,
            257,
            258,
            259,
            260,
            261,
            263,
            264,
            265,
            266,
            267,
            268,
            270,
            272,
            273,
            274,
            275,
            277,
            278,
            279,
            280,
            283,
            289,
            292,
            294,
            295,
            296,
            297,
            298,
            299,
            300,
            301,
            304,
            305,
            306,
            307,
            309,
            311,
            312,
            316,
            318,
            321,
            332,
            333,
            335,
            336,
            350,
            351,
            352,
            353,
            474,
            481,
            490,
            515,
            516,
            522,
            527,
            531
          ]
        },
        "R2": {
          "n_violations": 719,
          "indices": [
            8,
            9,
            10,
            11,
            12,
            13,
            14,
            15,
            16,
            17,
            18,
            19,
            20,
            21,
            22,
            23,
            24,
            25,
            26,
            27,
            28,
            29,
            30,
            31,
            32,
            33,
            34,
            35,
            36,
            37,
            38,
            39,
            40,
            41,
            42,
            43,
            44,
            45,
            46,
            47,
            48,
            49,
            50,
            51,
            52,
            53,
            54,
            55,
            56,
            57,
            58,
            59,
            60,
            61,
            62,
            63,
            64,
            65,
            66,
            67,
            68,
            69,
            70,
            71,
            72,
            73,
            74,
            75,
            76,
            77,
            78,
            79,
            80,
            81,
            82,
            83,
            84,
            85,
            86,
            87,
            88,
            89,
            90,
            91,
            92,
            93,
            94,
            95,
            96,
            97,
            98,
            99,
            100,
            101,
            102,
            103,
            104,
            105,
            106,
            107,
            108,
            109,
            110,
            111,
            112,
            113,
            114,
            115,
            116,
            117,
            118,
            119,
            120,
            121,
            122,
            123,
            124,
            125,
            126,
            127,
            128,
            129,
            130,
            131,
            132,
            133,
            134,
            135,
            136,
            137,
            138,
            139,
            140,
            141,
            142,
            143,
            144,
            145,
            146,
            147,
            148,
            149,
            150,
            151,
            152,
            153,
            154,
            155,
            156,
            157,
            158,
            159,
            160,
            161,
            162,
            163,
            164,
            165,
            166,
            167,
            168,
            169,
            170,
            171,
            172,
            173,
            174,
            175,
            176,
            177,
            178,
            179,
            180,
            181,
            182,
            183,
            184,
            185,
            186,
            187,
            188,
            189,
            190,
            191,
            192,
            193,
            194,
            195,
            196,
            197,
            198,
            199,
            200,
            201,
            202,
            203,
            204,